Neuralgia,sudden severe pain in the area of nerve,skin sensitivity,skin numbness,weakness,paralysis,,,,,,,,,,,,,,,,,,,,,,,,,,,,,,,,,,,,,,,,,,,,,,,,,,,,,,,,,,,,,,,,,,,,,,,,,,,,,,,,,,,,,,,,,,,,,,,,,
Nipah virus infection,fever,disturbances during sleep,headache,weakness,respiratory problem,disorientation,severe mental confusion,fits,personality changes,,,,,,,,,,,,,,,,,,,,,,,,,,,,,,,,,,,,,,,,,,,,,,,,,,,,,,,,,,,,,,,,,,,,,,,,,,,,,,,,,,,,,,,,,,,,,
Nonalcoholic fatty liver disease(NAFLD),weakness,discomfort in upper right side of abdomen,inflammation of the liver,,,,,,,,,,,,,,,,,,,,,,,,,,,,,,,,,,,,,,,,,,,,,,,,,,,,,,,,,,,,,,,,,,,,,,,,,,,,,,,,,,,,,,,,,,,,,,,,,,,
Obsessive Compulsive Disorder,recurrent fear,severe mental confusion,random acts done to reduce anxiety., repeated thoughts of hands being dirty,Excessive washing or cleaning,Avoiding particular numbers,,,,,,,,,,,,,,,,,,,,,,,,,,,,,,,,,,,,,,,,,,,,,,,,,,,,,,,,,,,,,,,,,,,,,,,,,,,,,,,,,,,,,,,,,,,,,,,,
Oral Cancer,white patches on tongue,red patches on tongue,white patches in mouth,red patches in mouth,sores in mouth,prolong swelling in mouth,pain during swallowing,neck pain,harsh voice,weight disturbances(increase/decrease),changes in sense of taste or smell,ear pain,swelling of lymph glands,,,,,,,,,,,,,,,,,,,,,,,,,,,,,,,,,,,,,,,,,,,,,,,,,,,,,,,,,,,,,,,,,,,,,,,,,,,,,,,,,,,,,,,,,
Osteoarthritis,joint pain,joint stiffness,cracking of joints,swelling in joints,tenderness in joints,joint deformity,,,,,,,,,,,,,,,,,,,,,,,,,,,,,,,,,,,,,,,,,,,,,,,,,,,,,,,,,,,,,,,,,,,,,,,,,,,,,,,,,,,,,,,,,,,,,,,,
Osteoporosis, fracture due to sudden impact,fragility in vertebral column,fragility in ribs,fragility in  hip,joint pain,swelling,loss of height,stooped posture,Disfigurement,curved upper back,weakness,,,,,,,,,,,,,,,,,,,,,,,,,,,,,,,,,,,,,,,,,,,,,,,,,,,,,,,,,,,,,,,,,,,,,,,,,,,,,,,,,,,,,,,,,,,
Otitis Media,ear pain,high fever,weakness,slight deafness,blocked nose or runny nose,cough,,,,,,,,,,,,,,,,,,,,,,,,,,,,,,,,,,,,,,,,,,,,,,,,,,,,,,,,,,,,,,,,,,,,,,,,,,,,,,,,,,,,,,,,,,,,,,,,
Rabies,anxiety,difficulty sleeping,confusion,Agitation,fever,disturbances during sleep,headache,nausea,vomiting,fear from water,aerophobia ,light sensitivity of eyes,abnormal behaviour,Hallucinations,violent behaviour,paralysis,respiratory problem,,,,,,,,,,,,,,,,,,,,,,,,,,,,,,,,,,,,,,,,,,,,,,,,,,,,,,,,,,,,,,,,,,,,,,,,,,,,,,,,,,,,,
Raynaud's Phenomenon,discoloration of the fingers,brittle nails,body part turns white,bluish discoloration of skin,numbness,skin numbness,,,,,,,,,,,,,,,,,,,,,,,,,,,,,,,,,,,,,,,,,,,,,,,,,,,,,,,,,,,,,,,,,,,,,,,,,,,,,,,,,,,,,,,,,,,,,,,,
Rheumatic fever and rheumatic heart disease,throat soreness,high fever,harsh voice,throat redness,pus from throat,unusual bleeding spots in throat,pain during swallowing,,,,,,,,,,,,,,,,,,,,,,,,,,,,,,,,,,,,,,,,,,,,,,,,,,,,,,,,,,,,,,,,,,,,,,,,,,,,,,,,,,,,,,,,,,,,,,,
Rubella(children),fever,skin rashes of red discoloration,swelling of lymph glands,high fever,cough,difficulty in breathing,weakness,throat soreness,blocked nose or runny nose,muscle pain,disturbances during sleep,headache,,,,,,,,,,,,,,,,,,,,,,,,,,,,,,,,,,,,,,,,,,,,,,,,,,,,,,,,,,,,,,,,,,,,,,,,,,,,,,,,,,,,,,,,,,
Scabies,itching,skin rashes,sores,itching in whole body,,,,,,,,,,,,,,,,,,,,,,,,,,,,,,,,,,,,,,,,,,,,,,,,,,,,,,,,,,,,,,,,,,,,,,,,,,,,,,,,,,,,,,,,,,,,,,,,,,
Schizophrenia,Hallucinations, Delusions,severe mental confusion,abnormal behaviour,,,,,,,,,,,,,,,,,,,,,,,,,,,,,,,,,,,,,,,,,,,,,,,,,,,,,,,,,,,,,,,,,,,,,,,,,,,,,,,,,,,,,,,,,,,,,,,,,,
Sexually transmitted infections (STIs),discharge from genital area,sores on genital parts,frequent urination,itching in genital area,redness in genital area,sores in mouth,abnormal genital area odour,unusual bleeding from anal,anal itching,anal soreness,pain during urination,abdomen pain,fever,,,,,,,,,,,,,,,,,,,,,,,,,,,,,,,,,,,,,,,,,,,,,,,,,,,,,,,,,,,,,,,,,,,,,,,,,,,,,,,,,,,,,,,,,
Shaken Baby Syndrome(infants),past child abuse,vomiting,weakness,irritability,trembling,excessive sleep,Failure to smile,,,,,,,,,,,,,,,,,,,,,,,,,,,,,,,,,,,,,,,,,,,,,,,,,,,,,,,,,,,,,,,,,,,,,,,,,,,,,,,,,,,,,,,,,,,,,,,
Silicosis,silica related occupation,abnormal breathing(slow),dry cough,bluish tint nails,difficulty sleeping,chest pain,appetite disturbances(low/high),,,,,,,,,,,,,,,,,,,,,,,,,,,,,,,,,,,,,,,,,,,,,,,,,,,,,,,,,,,,,,,,,,,,,,,,,,,,,,,,,,,,,,,,,,,,,,,
Spinal cord Injury,past accident history major or minor,partial or complete loss of sensory function,resistance in limb movement,loss of control of bowel movement,loss of control of bladder,unnatural position of neck,chronic pain in back,blackout,signs of sock,,,,,,,,,,,,,,,,,,,,,,,,,,,,,,,,,,,,,,,,,,,,,,,,,,,,,,,,,,,,,,,,,,,,,,,,,,,,,,,,,,,,,,,,,,,,,
Stroke,weakness  of face,weakness  of arm,weakness  of legs,weakness of half body,confusion,trouble in speaking,trouble in understanding speech,poor eye focus,poor eye focus,trouble in walking,dizziness,trouble in walking,,,,,,,,,,,,,,,,,,,,,,,,,,,,,,,,,,,,,,,,,,,,,,,,,,,,,,,,,,,,,,,,,,,,,,,,,,,,,,,,,,,,,,,,,,
Typhoid / Enteric fever,stale food eaten,high fever,vomiting,dry cough,disturbances during sleep,headache in front part,severe mental confusion,skin rashes,pink spots,swelling in abdomen,slow heartbeat,appetite disturbances(low/high),weight disturbances(increase/decrease),weakness,diarrhoea,abnormal breathing(fast),,,,,,,,,,,,,,,,,,,,,,,,,,,,,,,,,,,,,,,,,,,,,,,,,,,,,,,,,,,,,,,,,,,,,,,,,,,,,,,,,,,,,,
Ulcerative Colitis,abdomen pain,blood in stool,diarrhoea,weakness,appetite disturbances(low/high) ,high fever,Dehydration,urgency in bowel movement,weight disturbances(increase/decrease),abnormal breathing(slow),irregular heartbeat,yellow discoloration of the skin,,,,,,,,,,,,,,,,,,,,,,,,,,,,,,,,,,,,,,,,,,,,,,,,,,,,,,,,,,,,,,,,,,,,,,,,,,,,,,,,,,,,,,,,,,
Urticaria,skin patches,itching,itching of skin,red discoloration of skin,recurrent skin patches,,,,,,,,,,,,,,,,,,,,,,,,,,,,,,,,,,,,,,,,,,,,,,,,,,,,,,,,,,,,,,,,,,,,,,,,,,,,,,,,,,,,,,,,,,,,,,,,,
Varicose Veins,Aching and uncomfortable legs,Appearance of spider veins leg.,swelling of feet,Burning in legs,muscle cramp in legs,itching in legs,,,,,,,,,,,,,,,,,,,,,,,,,,,,,,,,,,,,,,,,,,,,,,,,,,,,,,,,,,,,,,,,,,,,,,,,,,,,,,,,,,,,,,,,,,,,,,,,
Vitamin B12 Deficiency,yellow discoloration of the skin,red patches on tongue,sores in mouth,An altered sense of touch,vision problem,irritability,depression,psychosis,memory problem,loss of sensation,weakness  of muscle,depression,,,,,,,,,,,,,,,,,,,,,,,,,,,,,,,,,,,,,,,,,,,,,,,,,,,,,,,,,,,,,,,,,,,,,,,,,,,,,,,,,,,,,,,,,,
Vitiligo,white patches on the skin,skin patches,depression,mood disorders,,,,,,,,,,,,,,,,,,,,,,,,,,,,,,,,,,,,,,,,,,,,,,,,,,,,,,,,,,,,,,,,,,,,,,,,,,,,,,,,,,,,,,,,,,,,,,,,,,
Whooping cough/Pertussis,cough,vomiting after cough,blocked nose or runny nose,sneezing,watery eyes,dry cough,throat soreness,fever,,,,,,,,,,,,,,,,,,,,,,,,,,,,,,,,,,,,,,,,,,,,,,,,,,,,,,,,,,,,,,,,,,,,,,,,,,,,,,,,,,,,,,,,,,,,,,
Xerophthalmia,light sensitivity of eyes,night blindness,light sensitivity of eyes,vision problem,scaly cornea,dry cornea,spots in eyes,degeneration of cornea,,,,,,,,,,,,,,,,,,,,,,,,,,,,,,,,,,,,,,,,,,,,,,,,,,,,,,,,,,,,,,,,,,,,,,,,,,,,,,,,,,,,,,,,,,,,,,
Zika virus disease,fever,skin rashes,muscle pain,joint pain,disturbances during sleep,headache,pain behind eyes,swelling of eyelids,,,,,,,,,,,,,,,,,,,,,,,,,,,,,,,,,,,,,,,,,,,,,,,,,,,,,,,,,,,,,,,,,,,,,,,,,,,,,,,,,,,,,,,,,,,,,,
Anaemia,weakness,abnormal breathing(slow),dizziness,cold hands or feet,yellow discoloration of the skin,chest pain,disturbances during sleep,headache,,,,,,,,,,,,,,,,,,,,,,,,,,,,,,,,,,,,,,,,,,,,,,,,,,,,,,,,,,,,,,,,,,,,,,,,,,,,,,,,,,,,,,,,,,,,,,
Anaemia during pregnancy (Maternal anemia),weakness,uncontrollable shaking of limbs,desire to eat or lick non-food item,yellow discoloration of eyelids,yellow discoloration of tongue,spoon-shaped nails,disturbances during sleep,headache,,,,,,,,,,,,,,,,,,,,,,,,,,,,,,,,,,,,,,,,,,,,,,,,,,,,,,,,,,,,,,,,,,,,,,,,,,,,,,,,,,,,,,,,,,,,,,
Anthrax,contact with any herbivore animal,itching,bump on skin,black sore,abdomen pain,vomiting with blood,,,,,,,,,,,,,,,,,,,,,,,,,,,,,,,,,,,,,,,,,,,,,,,,,,,,,,,,,,,,,,,,,,,,,,,,,,,,,,,,,,,,,,,,,,,,,,,,
Anxiety,recurrent fear,restlessness ,disturbances during sleep,weight disturbances(increase/decrease),weakness,dry mouth,abdomen cramps,disturbances during sleep,headache,Muscle tension and muscle aches,difficulty in swallowing,trembling,twitching of eye,sweating,appetite disturbances(low/high),,,,,,,,,,,,,,,,,,,,,,,,,,,,,,,,,,,,,,,,,,,,,,,,,,,,,,,,,,,,,,,,,,,,,,,,,,,,,,,,,,,,,,,
Appendicitis,Sudden pain on the right side of the lower abdomen,appetite disturbances(low/high),Sudden pain around navel and shifts to lower right abdomen,pain during cough,constipation,bloating,nausea,vomiting,fever,,,,,,,,,,,,,,,,,,,,,,,,,,,,,,,,,,,,,,,,,,,,,,,,,,,,,,,,,,,,,,,,,,,,,,,,,,,,,,,,,,,,,,,,,,,,,
Arthritis(ADULTS),joint pain,tenderness in joints,joint stiffness,loss of flexibility in joints,swelling,,,,,,,,,,,,,,,,,,,,,,,,,,,,,,,,,,,,,,,,,,,,,,,,,,,,,,,,,,,,,,,,,,,,,,,,,,,,,,,,,,,,,,,,,,,,,,,,,
Asthma,chest pain,pain during breathing,difficulty sleeping,severe cough,,,,,,,,,,,,,,,,,,,,,,,,,,,,,,,,,,,,,,,,,,,,,,,,,,,,,,,,,,,,,,,,,,,,,,,,,,,,,,,,,,,,,,,,,,,,,,,,,,
Astigmatism,vision problem,eye fatigue,disturbances during sleep,narrowing of eyes,itching of eyes,headache,double vision problem,,,,,,,,,,,,,,,,,,,,,,,,,,,,,,,,,,,,,,,,,,,,,,,,,,,,,,,,,,,,,,,,,,,,,,,,,,,,,,,,,,,,,,,,,,,,,,,
Atherosclerosis(middle age or old ages),chest pain,body pain,abnormal breathing(slow),weakness,confusion,weakness  of leg muscle,smoking,,,,,,,,,,,,,,,,,,,,,,,,,,,,,,,,,,,,,,,,,,,,,,,,,,,,,,,,,,,,,,,,,,,,,,,,,,,,,,,,,,,,,,,,,,,,,,,
Autism(children),avoiding eye contact with others,staying all alone,difficulty in understanding,trouble in speaking,Give unrelated answers to questions,Have obsessive interests,,,,,,,,,,,,,,,,,,,,,,,,,,,,,,,,,,,,,,,,,,,,,,,,,,,,,,,,,,,,,,,,,,,,,,,,,,,,,,,,,,,,,,,,,,,,,,,,
Chikungunya fever,muscle pain,weakness,nausea,disturbances during sleep,headache,skin rashes,joint pain,,,,,,,,,,,,,,,,,,,,,,,,,,,,,,,,,,,,,,,,,,,,,,,,,,,,,,,,,,,,,,,,,,,,,,,,,,,,,,,,,,,,,,,,,,,,,,,
Cholera,stomachache,fever,vomiting,diarrhoea,Fluid loss,,,,,,,,,,,,,,,,,,,,,,,,,,,,,,,,,,,,,,,,,,,,,,,,,,,,,,,,,,,,,,,,,,,,,,,,,,,,,,,,,,,,,,,,,,,,,,,,,
Chronic obstructive pulmonary disease (COPD),difficulty in breathing,Abnormal sputum,severe cough,Daily activities become very difficult ,,,,,,,,,,,,,,,,,,,,,,,,,,,,,,,,,,,,,,,,,,,,,,,,,,,,,,,,,,,,,,,,,,,,,,,,,,,,,,,,,,,,,,,,,,,,,,,,,,
cogenital myopia(inants),poor vision of eye,poor eye focus,squint,distant vision problem,holding things close to eyes,,,,,,,,,,,,,,,,,,,,,,,,,,,,,,,,,,,,,,,,,,,,,,,,,,,,,,,,,,,,,,,,,,,,,,,,,,,,,,,,,,,,,,,,,,,,,,,,,
Colorectal Cancer(cancer of colon and rectum),diarrhoea,constipation,blood in stool,abdomen pain,abdomen cramps,gas,weakness,weight disturbances(increase/decrease),,,,,,,,,,,,,,,,,,,,,,,,,,,,,,,,,,,,,,,,,,,,,,,,,,,,,,,,,,,,,,,,,,,,,,,,,,,,,,,,,,,,,,,,,,,,,,
Computer Vision Syndrome,dry eyes,watery eyes,eyestrain,redness of eyes,burning of eyes,vision problem,double vision problem,foreign body sensation in eyes,distant vision problem,disturbances during sleep,headache,back pain,neck pain,,,,,,,,,,,,,,,,,,,,,,,,,,,,,,,,,,,,,,,,,,,,,,,,,,,,,,,,,,,,,,,,,,,,,,,,,,,,,,,,,,,,,,,,,
Conjunctivitis,redness of eyes,itching,watery eyes,vision problem,burning of eyes,light sensitivity of eyes,watery eyes that prevent eye's opening,,,,,,,,,,,,,,,,,,,,,,,,,,,,,,,,,,,,,,,,,,,,,,,,,,,,,,,,,,,,,,,,,,,,,,,,,,,,,,,,,,,,,,,,,,,,,,,
Conjunctivochalasis,irritation in eyes,foreign body sensation in eyes,discomfort in eyes,burning of eyes,watery eyes,vision problem,dry eyes,eye fatigue,stiff eyes on awake,,,,,,,,,,,,,,,,,,,,,,,,,,,,,,,,,,,,,,,,,,,,,,,,,,,,,,,,,,,,,,,,,,,,,,,,,,,,,,,,,,,,,,,,,,,,,
Coronary Heart Disease,feeling heavy in heart,"pain below breastbone with pain in neck,arms,stomach or upper back",pain below breastbone,pain in heart after being emotional,abnormal breathing(slow),weakness,uneasy feeling in neck,uneasy feeling in stomach,uneasy feeling on upper back,,,,,,,,,,,,,,,,,,,,,,,,,,,,,,,,,,,,,,,,,,,,,,,,,,,,,,,,,,,,,,,,,,,,,,,,,,,,,,,,,,,,,,,,,,,,,
Coronavirus disease 2019 (COVID-19),changes in sense of taste or smell,throat soreness,runny nose,nausea,vomiting,diarrhoea,fever,cough,abnormal breathing(slow),difficulty in breathing,,,,,,,,,,,,,,,,,,,,,,,,,,,,,,,,,,,,,,,,,,,,,,,,,,,,,,,,,,,,,,,,,,,,,,,,,,,,,,,,,,,,,,,,,,,,
Dementia,abnormal behaviour,paranoia,Hallucinations,ANGER,personality changes,memory problem,trouble in speaking,trouble in understanding speech,Difficulty planning ,anxiety,confusion,Difficulty in coordinating,Difficulty handling complex tasks,depression,,,,,,,,,,,,,,,,,,,,,,,,,,,,,,,,,,,,,,,,,,,,,,,,,,,,,,,,,,,,,,,,,,,,,,,,,,,,,,,,,,,,,,,,
Fluorosis(child),white discoloration of tooth,white discoloration of tooth,brown discoloration of tooth,joint stiffness,joint pain,,,,,,,,,,,,,,,,,,,,,,,,,,,,,,,,,,,,,,,,,,,,,,,,,,,,,,,,,,,,,,,,,,,,,,,,,,,,,,,,,,,,,,,,,,,,,,,,,
Food Poisoning,Feeling unwell,vomiting,diarrhoea,abdomen cramps,stale food eaten,stale food eaten,abdomen pain,appetite disturbances(low/high),high fever,muscle pain,trembling,,,,,,,,,,,,,,,,,,,,,,,,,,,,,,,,,,,,,,,,,,,,,,,,,,,,,,,,,,,,,,,,,,,,,,,,,,,,,,,,,,,,,,,,,,,
Fracture (Bone fracture),pressure put on a bone,swelling,bruised skin,unusual bleeding,,,,,,,,,,,,,,,,,,,,,,,,,,,,,,,,,,,,,,,,,,,,,,,,,,,,,,,,,,,,,,,,,,,,,,,,,,,,,,,,,,,,,,,,,,,,,,,,,,
Gaming disorder,restlessness when unable to play,lying to others for playing games,Isolation from others,Poor personal hygiene,weight disturbances(increase/decrease),weakness,,,,,,,,,,,,,,,,,,,,,,,,,,,,,,,,,,,,,,,,,,,,,,,,,,,,,,,,,,,,,,,,,,,,,,,,,,,,,,,,,,,,,,,,,,,,,,,,
GERD,pain below breastbone,sour taste in back of mouth,difficulty in swallowing,,,,,,,,,,,,,,,,,,,,,,,,,,,,,,,,,,,,,,,,,,,,,,,,,,,,,,,,,,,,,,,,,,,,,,,,,,,,,,,,,,,,,,,,,,,,,,,,,,,
Glaucoma,side vision problem,tunnel vision problem,vision problem,pain in eyes,disturbances during sleep,headache,nausea,vomiting,seeing rainbow like rings around lights,whitening of the cornea,,,,,,,,,,,,,,,,,,,,,,,,,,,,,,,,,,,,,,,,,,,,,,,,,,,,,,,,,,,,,,,,,,,,,,,,,,,,,,,,,,,,,,,,,,,,
Goitre,swelling of lymph glands,cough,throat tightness,harsh voice,difficulty in breathing,difficulty in swallowing,,,,,,,,,,,,,,,,,,,,,,,,,,,,,,,,,,,,,,,,,,,,,,,,,,,,,,,,,,,,,,,,,,,,,,,,,,,,,,,,,,,,,,,,,,,,,,,,
Gonorrhea(men),greenish yellow genital area discharge,Burning sensation while passing urine,swollen and painful testicles,white penis discharge,,,,,,,,,,,,,,,,,,,,,,,,,,,,,,,,,,,,,,,,,,,,,,,,,,,,,,,,,,,,,,,,,,,,,,,,,,,,,,,,,,,,,,,,,,,,,,,,,,
Gonorrhea(women),greenish yellow genital area discharge,lower abdomen pain,burning feel during urination,redness of eyes,itching in eyes,unusual bleeding between periods,Spotting after intercourse,swelling of genital area,white vaginal discharge,,,,,,,,,,,,,,,,,,,,,,,,,,,,,,,,,,,,,,,,,,,,,,,,,,,,,,,,,,,,,,,,,,,,,,,,,,,,,,,,,,,,,,,,,,,,,
Gum disease,redness of eyes,swelling of gums,bad breath odour,receded gums,loose tooth,,,,,,,,,,,,,,,,,,,,,,,,,,,,,,,,,,,,,,,,,,,,,,,,,,,,,,,,,,,,,,,,,,,,,,,,,,,,,,,,,,,,,,,,,,,,,,,,,
Jaundice,yellow discoloration of the eyes,yellow discoloration of stool,dark urination,,,,,,,,,,,,,,,,,,,,,,,,,,,,,,,,,,,,,,,,,,,,,,,,,,,,,,,,,,,,,,,,,,,,,,,,,,,,,,,,,,,,,,,,,,,,,,,,,,,
Kala-azar/ Leishmaniasis/black fever,appetite disturbances(low/high),weight disturbances(increase/decrease),dry skin,scaly skin patches,hair loss,grayish discoloration of the skin,,,,,,,,,,,,,,,,,,,,,,,,,,,,,,,,,,,,,,,,,,,,,,,,,,,,,,,,,,,,,,,,,,,,,,,,,,,,,,,,,,,,,,,,,,,,,,,,
lactose intolerance,milk drank in past hours,bloating,gas,diarrhoea,nausea,vomiting,abdomen pain,sounds from stomach,fever,urgency in bowel movement,,,,,,,,,,,,,,,,,,,,,,,,,,,,,,,,,,,,,,,,,,,,,,,,,,,,,,,,,,,,,,,,,,,,,,,,,,,,,,,,,,,,,,,,,,,,
Lead poisoning,nausea,vomiting,abdomen pain,constipation,metallic taste,reduced iq,abnormal behaviour,abnormal behaviour,violent behaviour,difficulty in concentration,disturbances during sleep,headache,weakness,general discomfort,trouble in speaking,fits,,,,,,,,,,,,,,,,,,,,,,,,,,,,,,,,,,,,,,,,,,,,,,,,,,,,,,,,,,,,,,,,,,,,,,,,,,,,,,,,,,,,,,
Leprosy,faded sore on skin,unusual skin growth,dry skin,severe pain,skin numbness,weakness  of muscle,paralysis,Enlarged nerves,blocked nose,sores on soles of feet,,,,,,,,,,,,,,,,,,,,,,,,,,,,,,,,,,,,,,,,,,,,,,,,,,,,,,,,,,,,,,,,,,,,,,,,,,,,,,,,,,,,,,,,,,,,
Leptospirosis,high fever,disturbances during sleep,headache,nausea,vomiting,muscle pain,redness of eyes,irritation in eyes,cough,skin rashes,weakness,Hearing loss,respiratory problem,,,,,,,,,,,,,,,,,,,,,,,,,,,,,,,,,,,,,,,,,,,,,,,,,,,,,,,,,,,,,,,,,,,,,,,,,,,,,,,,,,,,,,,,,
Leukemia,yellow discoloration of the skin,weakness,Unusual and frequent bleeding,bruised skin,repeated infections,high fever,sweating,bone pain,joint pain,weight disturbances(increase/decrease),difficulty in breathing,sweating in night,,,,,,,,,,,,,,,,,,,,,,,,,,,,,,,,,,,,,,,,,,,,,,,,,,,,,,,,,,,,,,,,,,,,,,,,,,,,,,,,,,,,,,,,,,
Lichen Planus(mouth),white patches in mouth,white patches on tongue,white patches in mouth,red patches in mouth,discomfort in mouth,pain in gums,redness of eyes,recurrent sores in mouth,,,,,,,,,,,,,,,,,,,,,,,,,,,,,,,,,,,,,,,,,,,,,,,,,,,,,,,,,,,,,,,,,,,,,,,,,,,,,,,,,,,,,,,,,,,,,,
Lichen Planus(penis)(men),patches on penis,patches on penis,skin rashes,,,,,,,,,,,,,,,,,,,,,,,,,,,,,,,,,,,,,,,,,,,,,,,,,,,,,,,,,,,,,,,,,,,,,,,,,,,,,,,,,,,,,,,,,,,,,,,,,,,
Lichen Planus(skin),purple-red bumps on the skin,,bumps with irregular white streaks ,scaly skin patches,itching,,,,,,,,,,,,,,,,,,,,,,,,,,,,,,,,,,,,,,,,,,,,,,,,,,,,,,,,,,,,,,,,,,,,,,,,,,,,,,,,,,,,,,,,,,,,,,,,,
Nasal Polyps,difficulty in breathing,blocked nose,snoring,runny nose,mucus that drips from the back of nose down the throat ,changes in sense of taste or smell,,,,,,,,,,,,,,,,,,,,,,,,,,,,,,,,,,,,,,,,,,,,,,,,,,,,,,,,,,,,,,,,,,,,,,,,,,,,,,,,,,,,,,,,,,,,,,,,
Neonatal Respiratory Disease Syndrome(NRDS)(infants),abnormal breathing(fast),fast heartbeat,bluish discoloration of skin,,less urination,harsh voice,blocked nose or runny nose,abnormal breathing(slow),abnormal breathing(slow/fast),,,,,,,,,,,,,,,,,,,,,,,,,,,,,,,,,,,,,,,,,,,,,,,,,,,,,,,,,,,,,,,,,,,,,,,,,,,,,,,,,,,,,,,,,,,,,
Neuralgia,sudden severe pain in the area of nerve,skin sensitivity,skin numbness,weakness,paralysis,,,,,,,,,,,,,,,,,,,,,,,,,,,,,,,,,,,,,,,,,,,,,,,,,,,,,,,,,,,,,,,,,,,,,,,,,,,,,,,,,,,,,,,,,,,,,,,,,
Nipah virus infection,fever,disturbances during sleep,headache,weakness,respiratory problem,disorientation,severe mental confusion,fits,personality changes,,,,,,,,,,,,,,,,,,,,,,,,,,,,,,,,,,,,,,,,,,,,,,,,,,,,,,,,,,,,,,,,,,,,,,,,,,,,,,,,,,,,,,,,,,,,,
Nonalcoholic fatty liver disease(NAFLD),weakness,discomfort in upper right side of abdomen,inflammation of the liver,,,,,,,,,,,,,,,,,,,,,,,,,,,,,,,,,,,,,,,,,,,,,,,,,,,,,,,,,,,,,,,,,,,,,,,,,,,,,,,,,,,,,,,,,,,,,,,,,,,
Obsessive Compulsive Disorder,recurrent fear,severe mental confusion,random acts done to reduce anxiety., repeated thoughts of hands being dirty,Excessive washing or cleaning,Avoiding particular numbers,,,,,,,,,,,,,,,,,,,,,,,,,,,,,,,,,,,,,,,,,,,,,,,,,,,,,,,,,,,,,,,,,,,,,,,,,,,,,,,,,,,,,,,,,,,,,,,,
Oral Cancer,white patches on tongue,red patches on tongue,white patches in mouth,red patches in mouth,sores in mouth,prolong swelling in mouth,pain during swallowing,neck pain,harsh voice,weight disturbances(increase/decrease),changes in sense of taste or smell,ear pain,swelling of lymph glands,,,,,,,,,,,,,,,,,,,,,,,,,,,,,,,,,,,,,,,,,,,,,,,,,,,,,,,,,,,,,,,,,,,,,,,,,,,,,,,,,,,,,,,,,
Osteoarthritis,joint pain,joint stiffness,cracking of joints,swelling in joints,tenderness in joints,joint deformity,,,,,,,,,,,,,,,,,,,,,,,,,,,,,,,,,,,,,,,,,,,,,,,,,,,,,,,,,,,,,,,,,,,,,,,,,,,,,,,,,,,,,,,,,,,,,,,,
Osteoporosis, fracture due to sudden impact,fragility in vertebral column,fragility in ribs,fragility in  hip,joint pain,swelling,loss of height,stooped posture,Disfigurement,curved upper back,weakness,,,,,,,,,,,,,,,,,,,,,,,,,,,,,,,,,,,,,,,,,,,,,,,,,,,,,,,,,,,,,,,,,,,,,,,,,,,,,,,,,,,,,,,,,,,
Otitis Media,ear pain,high fever,weakness,slight deafness,blocked nose or runny nose,cough,,,,,,,,,,,,,,,,,,,,,,,,,,,,,,,,,,,,,,,,,,,,,,,,,,,,,,,,,,,,,,,,,,,,,,,,,,,,,,,,,,,,,,,,,,,,,,,,
Raynaud's Phenomenon,discoloration of the fingers,brittle nails,body part turns white,bluish discoloration of skin,numbness,skin numbness,,,,,,,,,,,,,,,,,,,,,,,,,,,,,,,,,,,,,,,,,,,,,,,,,,,,,,,,,,,,,,,,,,,,,,,,,,,,,,,,,,,,,,,,,,,,,,,,
Rheumatic fever and rheumatic heart disease,throat soreness,high fever,harsh voice,throat redness,pus from throat,unusual bleeding spots in throat,pain during swallowing,,,,,,,,,,,,,,,,,,,,,,,,,,,,,,,,,,,,,,,,,,,,,,,,,,,,,,,,,,,,,,,,,,,,,,,,,,,,,,,,,,,,,,,,,,,,,,,
Rubella(children),fever,skin rashes of red discoloration,swelling of lymph glands,high fever,cough,difficulty in breathing,weakness,throat soreness,blocked nose or runny nose,muscle pain,disturbances during sleep,headache,,,,,,,,,,,,,,,,,,,,,,,,,,,,,,,,,,,,,,,,,,,,,,,,,,,,,,,,,,,,,,,,,,,,,,,,,,,,,,,,,,,,,,,,,,
Scabies,itching,skin rashes,sores,itching in whole body,,,,,,,,,,,,,,,,,,,,,,,,,,,,,,,,,,,,,,,,,,,,,,,,,,,,,,,,,,,,,,,,,,,,,,,,,,,,,,,,,,,,,,,,,,,,,,,,,,
Schizophrenia,Hallucinations, Delusions,severe mental confusion,abnormal behaviour,,,,,,,,,,,,,,,,,,,,,,,,,,,,,,,,,,,,,,,,,,,,,,,,,,,,,,,,,,,,,,,,,,,,,,,,,,,,,,,,,,,,,,,,,,,,,,,,,,
Sexually transmitted infections (STIs),discharge from genital area,sores on genital parts,frequent urination,itching in genital area,redness in genital area,sores in mouth,abnormal genital area odour,unusual bleeding from anal,anal itching,anal soreness,pain during urination,abdomen pain,fever,,,,,,,,,,,,,,,,,,,,,,,,,,,,,,,,,,,,,,,,,,,,,,,,,,,,,,,,,,,,,,,,,,,,,,,,,,,,,,,,,,,,,,,,,
Shaken Baby Syndrome(infants),past child abuse,vomiting,weakness,irritability,trembling,excessive sleep,Failure to smile,,,,,,,,,,,,,,,,,,,,,,,,,,,,,,,,,,,,,,,,,,,,,,,,,,,,,,,,,,,,,,,,,,,,,,,,,,,,,,,,,,,,,,,,,,,,,,,
Silicosis,silica related occupation,abnormal breathing(slow),dry cough,bluish tint nails,difficulty sleeping,chest pain,appetite disturbances(low/high),,,,,,,,,,,,,,,,,,,,,,,,,,,,,,,,,,,,,,,,,,,,,,,,,,,,,,,,,,,,,,,,,,,,,,,,,,,,,,,,,,,,,,,,,,,,,,,
Spinal cord Injury,past accident history major or minor,partial or complete loss of sensory function,resistance in limb movement,loss of control of bowel movement,loss of control of bladder,unnatural position of neck,chronic pain in back,blackout,signs of sock,,,,,,,,,,,,,,,,,,,,,,,,,,,,,,,,,,,,,,,,,,,,,,,,,,,,,,,,,,,,,,,,,,,,,,,,,,,,,,,,,,,,,,,,,,,,,
Stroke,weakness  of face,weakness  of arm,weakness  of legs,weakness of half body,confusion,trouble in speaking,trouble in understanding speech,poor eye focus,poor eye focus,trouble in walking,dizziness,trouble in walking,,,,,,,,,,,,,,,,,,,,,,,,,,,,,,,,,,,,,,,,,,,,,,,,,,,,,,,,,,,,,,,,,,,,,,,,,,,,,,,,,,,,,,,,,,
Abducens nerve Palsy,double vision problem,inward deviation of eyeball,involuntary closing of one eye,,,,,,,,,,,,,,,,,,,,,,,,,,,,,,,,,,,,,,,,,,,,,,,,,,,,,,,,,,,,,,,,,,,,,,,,,,,,,,,,,,,,,,,,,,,,,,,,,,,
Acquired Immuno Deficiency Syndrome,vision problem,sweating in night,high fever,diarrhoea for long,weakness,weight disturbances(increase/decrease),fever,throat soreness,sore muscles,skin rashes,joint pain,diarrhoea,sweating in night,high fever,diarrhoea for long,abnormal weakness ,weight disturbances(increase/decrease),skin rashes,abnormal breathing(slow),cough,trembling,white patches on tongue,white patches in mouth,sores on tongue,sores in mouth,disturbances during sleep,headache,sores in mouth,sores on genital parts,swelling of lymph glands,mainly on the neck,,,,,,,,,,,,,,,,,,,,,,,,,,,,,,,,,,,,,,,,,,,,,,,,,,,,,,,,,,,,,,,,,,,,,,,
Acute encephalitis syndrome(CHILDREN),fever,confusion,disorientation,trouble in speaking,abnormal behaviour,,,,,,,,,,,,,,,,,,,,,,,,,,,,,,,,,,,,,,,,,,,,,,,,,,,,,,,,,,,,,,,,,,,,,,,,,,,,,,,,,,,,,,,,,,,,,,,,,
Alcohol intoxication,vomiting,nausea,abnormal breathing(slow),abnormal breathing(slow/fast),severe mental confusion,yellow discoloration of the skin,blackout,mood disorders,memory problem,,,,,,,,,,,,,,,,,,,,,,,,,,,,,,,,,,,,,,,,,,,,,,,,,,,,,,,,,,,,,,,,,,,,,,,,,,,,,,,,,,,,,,,,,,,,,
alcoholism/alcohol addiction,Not being able to keep a tab on the amount of alcohol a person drinks,Failing to cut down on number of drinks after repeated attempts,Spending too much of time drinking alcohol,Always finding a reason to drink,Not performing well at school or work due to alcoholism,Continuing to drink even if it causes health or financial issues,,,showing no interest in social,occupational and recreational activities,,,,,,,,,,,,,,,,,,,,,,,,,,,,,,,,,,,,,,,,,,,,,,,,,,,,,,,,,,,,,,,,,,,,,,,,,,,,,,,,,,,,,,,,,,,,
Alzheimer's Disease,memory problem,memory problem,Difficulty in planning and problem solving,Difficulty in doing previously familiar tasks,difficulty in concentration,Difficulty in spatial relationships like remembering roads and routes to a particular destination,abnormal behaviour,violent behaviour,,,,,,,,,,,,,,,,,,,,,,,,,,,,,,,,,,,,,,,,,,,,,,,,,,,,,,,,,,,,,,,,,,,,,,,,,,,,,,,,,,,,,,,,,,,,,,
Amaurosis Fugax,sudden partial or complete diminish of vision,contrast vision problem,sparkling in front of eyes,pain in eyes,,,,,,,,,,,,,,,,,,,,,,,,,,,,,,,,,,,,,,,,,,,,,,,,,,,,,,,,,,,,,,,,,,,,,,,,,,,,,,,,,,,,,,,,,,,,,,,,,,
Amblyopia(poor vision of eye)(CHILD),contrast vision problem,loss of focus with one eye,light sensitivity of eyes,,,,,,,,,,,,,,,,,,,,,,,,,,,,,,,,,,,,,,,,,,,,,,,,,,,,,,,,,,,,,,,,,,,,,,,,,,,,,,,,,,,,,,,,,,,,,,,,,,,
